{
  "key_id": "1234abcd-12ab-34cd-56ef-1234567890ab",
  "arn": "arn:aws:kms:us-east-1:111122223333:key/1234abcd-12ab-34cd-56ef-1234567890ab",
  "alias": "alias/payments-prod",
  "description": "Encrypts cardholder data and payment tokens for the payments service in production.",
  "provider": "aws-kms",
  "key_spec": "SYMMETRIC_DEFAULT",
  "key_usage": "ENCRYPT_DECRYPT",
  "origin": "AWS_KMS",
  "state": "Enabled",
  "rotation_enabled": true,
  "rotation_period_days": 365,
  "multi_region": false,
  "created_at": "2026-05-19T14:21:00Z",
  "tags": [
    { "key": "service", "value": "payments" },
    { "key": "env", "value": "prod" },
    { "key": "compliance", "value": "pci-dss" }
  ]
}
